Authors,Title,Year,Source title,Cited by,DOI,Link,Abstract
"Venkatesh V., Rai A., Sykes T.A., Aljafari R.","Combating infant mortality in Rural India: Evidence from a field study of Ehealth Kiosk implementations",2016,"MIS Quarterly: Management Information Systems",84,"10.25300/MISQ/2016/40.2.04","https://www.scopus.com/inward/record.uri?eid=2-s2.0-84973569784&doi=10.25300%2fMISQ%2f2016%2f40.2.04&partnerID=40&md5=8d2339588df345b3450f2c624afb4f73","The United Nations' Millennium Development Goals listed high infant mortality rates as a major problem in developing countries, especially in rural areas. Given the powerful information dissemination capabilities, information and communication technologies (ICTs) have been suggested as interventions to build infant care awareness and to modify healthcare behaviors. We examine how the use of one ICT intervention-specifically, eHealth kiosks disseminating authenticated and accessible medical information-can alleviate the problem of high infant mortality in rural India. We investigate how mothers' social networks affect their use of eHealth kiosks, seeking professional medical care for their infants and, ultimately, infant mortality. Drawing on the social epidemiology and social networks literatures, we focus on advice and hindrance from both strong and weak ties as the conduit of social influence on mothers' health-related behaviors for the care of their infants. Over a period of 7 years, we studied 4,620 infants across 10 villages where the eHealth kiosks were implemented along with support resources for proxy use. The results revealed that (1) eHealth kiosk use promotes seeking professional medical care and reduces infant mortality, (2) mothers are especially vulnerable to hindrance from both strong and weak ties as they choose to maintain the status quo of traditional infant healthcare practices (e.g., reliance on untrained personnel, superstitions, fatalism) in villages, and (3) advice from both strong and weak ties offers the potential to break down misplaced beliefs about infant healthcare practices and to develop literacy on seeking professional medical care. In contrast, in a comparative group of 10 neighboring villages, the reduction in infant mortality was not as pronounced and the effect of professional medical care in reducing infant mortality was lower. Our findings suggest that an ICT intervention can effectively address one of society's most important problems (i.e., infant mortality) even in parts of the world with limited resources and deep suspicion of technology and change. Overall, we believe such an ICT intervention will complement other investments being made, including the facilitation of use (proxy use) and provision of professional medical facilities to reduce infant mortality."
"Aanestad M., Jensen T.B.","Collective mindfulness in post-implementation IS adaptation processes",2016,"Information and Organization",32,"10.1016/j.infoandorg.2016.02.001","https://www.scopus.com/inward/record.uri?eid=2-s2.0-84964499617&doi=10.1016%2fj.infoandorg.2016.02.001&partnerID=40&md5=ad40e651e1ebf46809dc6a13fbf9dfff","The organizational consequences of implementing information systems (IS) in organizations have primarily been studied during the implementation or early post-implementation phase. We argue for the need to study the continuous organizational adaptation of evolving IS because of the challenges such processes pose for users, as well as the organizational capabilities they demand. We report from a qualitative study in a hospital setting in which a scanning project was initiated two years after the initial implementation of an Electronic Health Record system. The project was initially conceived to be minor, but led to thorough redesign of work processes and routines. We give a detailed account of the challenges encountered and the actions taken as part of the users' sensemaking in this project. By describing how the making, giving, demanding, specification, and breaking of sense were carried out, we identify the way in which the organizational capability we call ""collective mindfulness"" was achieved. Being aware of how to practically achieve collective mindfulness, managers may be able to better facilitate mindful handling of post-implementation IS adaptation processes. © 2016 Elsevier Ltd."
"Shynkevich Y., McGinnity T.M., Coleman S.A., Belatreche A.","Forecasting movements of health-care stock prices based on different categories of news articles using multiple kernel learning",2016,"Decision Support Systems",56,"10.1016/j.dss.2016.03.001","https://www.scopus.com/inward/record.uri?eid=2-s2.0-84980052300&doi=10.1016%2fj.dss.2016.03.001&partnerID=40&md5=0e097cd29a9ec822a11f4f33dda493fb","The market state changes when a new piece of information arrives. It affects decisions made by investors and is considered to be an important data source that can be used for financial forecasting. Recently information derived from news articles has become a part of financial predictive systems. The usage of news articles and their forecasting potential have been extensively researched. However, so far no attempts have been made to utilise different categories of news articles simultaneously. This paper studies how the concurrent, and appropriately weighted, usage of news articles, having different degrees of relevance to the target stock, can improve the performance of financial forecasting and support the decision-making process of investors and traders. Stock price movements are predicted using the multiple kernel learning technique which integrates information extracted from multiple news categories while separate kernels are utilised to analyse each category. News articles are partitioned according to their relevance to the target stock, its sub-industry, industry, group industry and sector. The experiments are run on stocks from the Health Care sector and show that increasing the number of relevant news categories used as data sources for financial forecasting improves the performance of the predictive system in comparison with approaches based on a lower number of categories. © 2016 Elsevier B.V. All rights reserved."
"Gómez-Vallejo H.J., Uriel-Latorre B., Sande-Meijide M., Villamarín-Bello B., Pavón R., Fdez-Riverola F., Glez-Peña D.","A case-based reasoning system for aiding detection and classification of nosocomial infections",2016,"Decision Support Systems",48,"10.1016/j.dss.2016.02.005","https://www.scopus.com/inward/record.uri?eid=2-s2.0-84959377705&doi=10.1016%2fj.dss.2016.02.005&partnerID=40&md5=c72750c96947d898d82c5029666e093c","Nowadays, it is recognized worldwide that healthcare-associated infections are responsible for an increase in patient morbidity, mortality, and higher costs related to prolonged hospital stays. As electronic health data are increasingly available today, there is a unique opportunity to implement real-time decision support systems for automating the surveillance of healthcare-associated infections. As a consequence, different electronic surveillance systems have been implemented to date with varying degrees of success. However, there have been few instances in which clinical data and physician narratives with the potential to significantly improve electronic surveillance alternatives have been adopted. In this context, the present work introduces a case-based reasoning system for the automatic surveillance and diagnosis of healthcare-associated infections. The developed system makes use of different machine learning techniques in order to (i) automatically extract evidence from different types of data including clinical unstructured documents, (ii) incorporate static a priori knowledge handled by infection preventionists, and (iii) dynamically generate new knowledge as well as understandable explanations about the system's decisions. Results obtained from a real deployment in a public hospital belonging to the Spanish National Health System trained with 2569 samples belonging to 1800 patients during more than 10 consecutive months recognize the usefulness of the system. © 2016 Elsevier B.V. All rights reserved."
"Goh J.M., Gao G.G., Agarwal R.","The creation of social value: Can an online health community reduce rural-urban health disparities?",2016,"MIS Quarterly: Management Information Systems",199,"10.25300/MISQ/2016/40.1.11","https://www.scopus.com/inward/record.uri?eid=2-s2.0-84961827136&doi=10.25300%2fMISQ%2f2016%2f40.1.11&partnerID=40&md5=41501a1cec7ffafdd3f835fa7b2586f2","The striking growth of online communities in recent years has sparked significant interest in understanding and quantifying benefits of participation. While research has begun to document the economic outcomes associated with online communities, quantifying the social value created in these collectives has been largely overlooked. This study proposes that online health communities create social value by addressing rural-urban health disparities via improved health capabilities. Using a unique data set from a rare disease community, we provide one of the first empirical studies of social value creation. Our quantitative analysis using exponential random graph models reveals patterns of social support exchanged between users and the variations in these patterns based on users' location. We find that, overall, urban users are net suppliers of social support while rural participants are net recipients, suggesting that technology-mediated online health communities are able to alleviate rural-urban health disparities. This study advances extant understanding of value production in online collectives, and yields implications for policy."
"Kwon H.E., So H., Han S.P., Oh W.","Excessive dependence on mobile social apps: A rational addiction perspective",2016,"Information Systems Research",82,"10.1287/isre.2016.0658","https://www.scopus.com/inward/record.uri?eid=2-s2.0-85010433197&doi=10.1287%2fisre.2016.0658&partnerID=40&md5=dec052cc275a6ed9e8eaed85e05d512e","Drawing on the rational addiction framework, this study explores the digital vulnerabilities driven by dependence on mobile social apps (e.g., social network sites and social games). Rational addicts anticipate the future consequences of their current behaviors and attempt to maximize utility from their intertemporal consumption choices. Conversely, myopic addicts tend toward immediate gratification and fail to fully recognize the future consequences of their current consumption. In lieu of conducting self-report surveys or aggregatelevel demand estimation, this research examines addictive behaviors on the basis of consumption quantity at an individual level. To empirically validate rational addiction in the context of social app consumption, we collect and analyze 13-month, individual-level panel data on the weekly app usage of thousands of smartphone users. Results indicate that the average social app user conducts herself in a forward-looking manner and rationally adjusts consumption over time to derive optimal utility. The subgroup analysis, however, indicates that substantial variations in addictiveness and forward-looking propensities exist across demographically diverse groups. For example, addictive behaviors toward social network sites are more myopic in nature among older, less-educated, high-income groups. Additionally, the type of social app moderates the effects of demographic characteristics on the nature of addictive behaviors. We provide implications that policymakers can use to effectively manage mobile addiction problems, with the recommendations focusing on asymmetric social policies (e.g., information- and capacity-enhancing measures). © 2016 INFORMS."
"Barrett M., Oborn E., Orlikowski W.","Creating value in online communities: The sociomaterial configuring of strategy, platform, and stakeholder engagement",2016,"Information Systems Research",143,"10.1287/isre.2016.0648","https://www.scopus.com/inward/record.uri?eid=2-s2.0-85010390779&doi=10.1287%2fisre.2016.0648&partnerID=40&md5=3e40d03e1974bfe55f3c373d8bbd9a15","How is value created in an online community (OC) over time? We explored this question through a longitudinal field study of an OC in the healthcare arena. We found that multiple kinds of value were produced and changed over time as different participants engaged with the OC and its evolving technology in various ways. To explain our findings, we theorize OC value as performed through the ongoing sociomaterial configuring of strategies, digital platforms, and stakeholder engagement. We develop a process perspective to explain these dynamics and identify multiple different kinds of value being created by an OC over time: financial, epistemic, ethical, service, reputational, and platform. Our research points to the importance of expanding the notion of OC users to encompass a broader understanding of stakeholders. It further suggests that creating OC value increasingly requires going beyond a dyadic relationship between the OC and the firm to encompassing a more complex relationship involving a wider ecosystem of stakeholders. © 2016 INFORMS."
"Van Laere J., Aggestam L.","Understanding champion behaviour in a health-care information system development project-how multiple champions and champion behaviours build a coherent whole",2016,"European Journal of Information Systems",26,"10.1057/ejis.2015.5","https://www.scopus.com/inward/record.uri?eid=2-s2.0-84959564592&doi=10.1057%2fejis.2015.5&partnerID=40&md5=7437224fa3ee8075f6e175e6389894c8","Champions are commonly suggested as a means of promoting the adoption of information systems. Since there are many different definitions of the concepts of champion and champion behaviour in the literature, practitioners and researchers may be confused about how to exactly use these concepts. A qualitative analysis of a single case study in a Swedish health-care organisation enabled us to explain how different champion behaviours relate to each other and how multiple champions interact. Combining our rich case observations with an analysis of champion literature reveals how champion behaviours form a coherent and meaningful whole in which networks of different types of champions at different levels in an organisation utilise their network of relations, their knowledge of the organisation and their insight into strategic decision-making politics to time and orchestrate the framing of innovations and the involvement of the right people. In conclusion, championing is a complex performance of contextually dependent collective social interaction, varying over time, rather than a heroic act of one individual promoting an idea. Future studies need to focus more on how the relations between different champions and their behaviours develop across innovations and over time, in order to develop a richer understanding of championing. © 2016 Operational Research Society Ltd."
"Klecun E.","Transforming healthcare: Policy discourses of IT and patient-centred care",2016,"European Journal of Information Systems",34,"10.1057/ejis.2014.40","https://www.scopus.com/inward/record.uri?eid=2-s2.0-84959533900&doi=10.1057%2fejis.2014.40&partnerID=40&md5=c7a2bbe5fff4dc8bff00c4173987f4b6","Information Technology (IT) is increasingly seen in policy and academic literature as key to the modernization of healthcare provision and to making healthcare patient-centred. However, the concept of Patient-Centred Care (PCC) and the role of IT in the transformation of healthcare are not straightforward. Their meanings need unpacking in order to reveal assumptions behind different visions and their implications for IT-enabled healthcare transformation. To this end, this paper reviews literature on PCC and IT and analyses England's health policy between 1989 and 2013. English policy has set out to transform healthcare from organization-centric to patient-centred and has placed IT as central to this process. This policy vision is based on contested conceptualizations of PCC. IT implementation is problematic and this is at least partly because of the underpinning goals and visions of healthcare policy. If this misalignment is not addressed then producing technologically superior systems, or better IT implementation strategies, is unlikely to result in widespread and substantial changes to the way healthcare is delivered and experienced. For IT to support a healthcare service that is truly patient-centred, patients' needs and wants need to be identified and designed into IT-enabled services rather than simply added on afterwards. © 2016 Operational Research Society Ltd."
"Pouloudi N., Currie W., Whitley E.A.","Entangled stakeholder roles and perceptions in health information systems: A longitudinal study of the U.K. NHS N3 Network",2016,"Journal of the Association for Information Systems",46,"10.17705/1jais.00421","https://www.scopus.com/inward/record.uri?eid=2-s2.0-84959372154&doi=10.17705%2f1jais.00421&partnerID=40&md5=8e46e7cd296f17d366732bfd0835337d","The combination of pervasive and complex technology and an increasingly challenging healthcare environment is the setting for this research study. As a longitudinal case study, the research tracked the development and implementation of a large private information systems network in the U.K. National Health Service (NHS). Using stakeholder theory, we unpacked the story of a complex network of stakeholder roles and perceptions and how they changed over time. Our findings suggest that favorable and unfavorable positions held by multiple stakeholder groups become entangled and that even the same focal group may adopt competing positions that undermine the adoption of the health network. As this situation develops, the policy and implementation of the broader health IT program becomes confused and destabilized. This study makes three contributions. First, it expands the literature on stakeholder theory in the IS domain. Second, it extends the managerial focus of stakeholder approaches to include policymaking in the diverse multi- stakeholder setting of healthcare. Third, it demonstrates how IS research can employ stakeholder analysis by adopting a broader, dynamic approach to identify different stakeholder groups and by focusing on their varied roles and views during the course of a large-scale health IT program. © 2016 by the Association for Information Systems."
"Chen L., Li X., Yang Y., Kurniawati H., Sheng Q.Z., Hu H.-Y., Huang N.","Personal health indexing based on medical examinations: A data mining approach",2016,"Decision Support Systems",32,"10.1016/j.dss.2015.10.008","https://www.scopus.com/inward/record.uri?eid=2-s2.0-84952863423&doi=10.1016%2fj.dss.2015.10.008&partnerID=40&md5=287f02cb0d1ab6806da25ac44c6d2fca","We design a method called MyPHI that predicts personal health index (PHI), a new evidence-based health indicator to explore the underlying patterns of a large collection of geriatric medical examination (GME) records using data mining techniques. We define PHI as a vector of scores, each reflecting the health risk in a particular disease category. The PHI prediction is formulated as an optimization problem that finds the optimal soft labels as health scores based on medical records that are infrequent, incomplete, and sparse. Our method is compared with classification models commonly used in medical applications. The experimental evaluation has demonstrated the effectiveness of our method based on a real-world GME data set collected from 102,258 participants. © 2015 Elsevier B.V. All rights reserved."
"Mindel V., Mathiassen L.","Contextualist inquiry into it-enabled hospital revenue cycle management: Bridging research and practice",2015,"Journal of the Association for Information Systems",14,"10.17705/1jais.00415","https://www.scopus.com/inward/record.uri?eid=2-s2.0-84952772145&doi=10.17705%2f1jais.00415&partnerID=40&md5=8ab2e91812420985b449925847aaec9e","Approximately a quarter of all U.S. non-for-profit hospitals operate with negative margins. In this unsustainable situation, revenue cycle management (RCM), the business process that drives revenue collection and accounts receivable administration, becomes increasingly crucial for healthcare organizations. RCM is at the center of an incredibly complex network of external and internal links, and its success chiefly depends on a smooth flow of timely, accurate information. While IS research increasingly focuses on clinical health information technologies (HITs), IT’s potential as an enabler of hospitals’ administrative activities remains by and large unexplored. To advance research into administrative HIT, we draw on Pettigrew’s (1987, 1990) theoretical contextualist framework of organizational transformation. Contextualist inquiry is particularly well suited to the study of complex organizational change processes, and it affords a comprehensive view on the opportunities and challenges involved in transforming IT-enabled RCM. Leveraging these strengths, we review the diverse body of academic literature related to RCM transformation and juxtapose the findings with the prevalent discourse in practitioner publications on RCM. These analyses reveal major gaps between extant theory and the problems faced in practice. In conclusion, we draw on these insights to propose research themes and theoretical lenses that can help bridge the gap between theory and practice. © 2015, Association for Information Systems. All rights reserved."
"Yeow A., Goh K.H.","Work harder or work smarter? Information technology and resource allocation in healthcare processes",2015,"MIS Quarterly: Management Information Systems",29,"10.25300/misq/2015/39.4.2","https://www.scopus.com/inward/record.uri?eid=2-s2.0-84961840039&doi=10.25300%2fmisq%2f2015%2f39.4.2&partnerID=40&md5=2a9003060db1754d8cf1b0d921b7e3f3","While the impacts of health information technology (HIT) are widely studied, prior research presents mixed findings. In this study, a granular examination of the impact of HIT systems on how resources are allocated to healthcare tasks and processes was undertaken. A longitudinal field study that combined interview, archival, observation, and survey data was conducted. The effects of telemedicine on the input allocative efficiency of the healthcare process through the reallocation of organizational resources was evaluated and an assessment of whether gains in allocative efficiency resulted in improvements in organizational outcomes, such as lower hospitalization rates and lower uncertainty in patient wait time, was conducted. Applying the theory of swift and even flow, our findings suggest that the gains in allocative efficiency for some processes are associated with improved organizational outcomes."
"Constantinou A.C., Freestone M., Marsh W., Coid J.","Causal inference for violence risk management and decision support in forensic psychiatry",2015,"Decision Support Systems",27,"10.1016/j.dss.2015.09.006","https://www.scopus.com/inward/record.uri?eid=2-s2.0-84945248123&doi=10.1016%2fj.dss.2015.09.006&partnerID=40&md5=8834d480b01cb2b3dfde727c890d0003","The purpose of medium secure services (MSS) is to provide accommodation, support, and treatment to individuals with enduring mental health problems who usually come into contact with the criminal justice system. These individuals are, therefore, believed to pose a risk of violence to themselves as well as to other individuals. Assessing and managing the risk of violence is considered to be a critical component for discharged decision making in MSS. Methods for violence risk assessment in this area of research are typically based on regression models or checklists with no statistical composition and which naturally demonstrate mediocre predictive performance and, more importantly, without providing genuine decision support. While Bayesian networks have become popular tools for decision support in the medical field over the last couple of decades, they have not been extensively studied in forensic psychiatry. In this paper, we describe a decision support system using Bayesian networks, which is mainly parameterised based on questionnaire, interviewing and clinical assessment data, for violence risk assessment and risk management in patients discharged from MSS. The results demonstrate moderate to significant improvements in forecasting capability. More importantly, we demonstrate how decision support is improved over the well-established approaches in this area of research, primarily by incorporating causal interventions and taking advantage of the model's ability in answering complex probabilistic queries for unobserved variables. © 2015 Elsevier B.V. All rights reserved."
"Hanseth O., Bygstad B.","Flexible generification: ICT standardization strategies and service innovation in health care",2015,"European Journal of Information Systems",65,"10.1057/ejis.2015.1","https://www.scopus.com/inward/record.uri?eid=2-s2.0-84948425408&doi=10.1057%2fejis.2015.1&partnerID=40&md5=b09ae1a69de30368c367bfdcc3e91287","Standards have played an important but often unrecognized role in the development of modern organizations. This role is accentuated by today's growth of large business and government infrastructures, in the turbulent processes of globalization. In this paper, we investigate the relationships-and tensions-between standardization strategies and service innovation in the health-care sector. Our empirical material is seven longitudinal case studies in the Norwegian health-care sector, collected and analysed over a period of 20 years. We identify three generic standardization strategies; anticipatory standardization, integrated solutions and flexible generification. We argue that the first two strategies do not support service innovation while the strategy of flexible generification does so. We consider our results important for the evolution of the future ICT-enabled service economy. © 2015 Operational Research Society Ltd."
