Authors,Title,Year,Source title,Cited by,DOI,Link,Abstract
"Xiong J., Zuo M.","Factors influencing health care professionals’ adoption of mobile platform of medical and senior care in China",2023,"Information and Management",,"10.1016/j.im.2023.103798","https://www.scopus.com/inward/record.uri?eid=2-s2.0-85152939456&doi=10.1016%2fj.im.2023.103798&partnerID=40&md5=ea4512417846e13a7a64153fd42eb0c5","A mobile platform of medical and senior care (MPMSC) is a platform that can provide one-stop medical and senior care services through mobile devices. This study developed a research model based on the value-based adoption model to understand the factors influencing health care professionals’ adoption of MPMSC. Empirical analysis has shown that perceived value and legal concerns can predict health care professionals’ intention to adopt MPMSC and that outcome expectations, perceived mobility, perceived effort, and privacy concerns can predict perceived value. Research findings can enhance the understanding of the factors influencing the adoption of MPMSC by health care professionals. © 2023 Elsevier B.V."
"Murungi D.M., Káganer E.","The argumentative salience of technology frames of reference: An analysis of argumentative discourse in the development of a health information exchange initiative",2023,"Information and Organization",,"10.1016/j.infoandorg.2023.100465","https://www.scopus.com/inward/record.uri?eid=2-s2.0-85152133735&doi=10.1016%2fj.infoandorg.2023.100465&partnerID=40&md5=9ade2e516ff3433cd1f3b3f32d461dc1","This study examines the impact that the argumentative salience of technology frames of references has on the execution of complex IS implementation projects. It employs Toulmin's argument model to develop argument maps that depict the structure of argumentation that took place during the development and implementation of an interorganizational health information exchange initiative (HIE) that took place in southeast USA. Toulmin's argument model faciliated the portrayal of frame salience in terms of three structural properties (i.e., blindness, indifference, and ownership). The study used these properties to show how the breadth, depth and conspicuity of frame structures changed during the course of the project and demonstrated how these changes impacted both the level of contestation observed in the project as well as project outcomes. In addition to lending insights that are specific to this case, our conceptualization of frame structure lends itself to cross-case comparisons and future theory building as the impact of these argument structures can be evaluated in a multitude of different contexts. © 2023 Elsevier Ltd"
"Ghasemi E., Sheikh-Zadeh A., Song J.","Effort as investment in healthcare dialogue-based agents: On the role of means-goal configurations",2023,"Decision Support Systems",,"10.1016/j.dss.2023.113943","https://www.scopus.com/inward/record.uri?eid=2-s2.0-85149984939&doi=10.1016%2fj.dss.2023.113943&partnerID=40&md5=5d8a3dc1a6861b3a5370f6ea8b7054c4","The recent pandemic and resultant increase in clinical caseload have brought dialogue-based agents (DBAs) to the forefront of attention in the healthcare industry. The ability of these agents to accomplish a variety of sequential and related tasks within a single application software has made them more effortful and complex. While effort requirements and complexity of information systems are generally considered negative attributes, the potential effect of user effort investment on user perceptions and decisions is less investigated. Within the framework of goal systems theory, this study explores how perceived effort could be appropriated to enhance users' positive perceptions and willingness to accept healthcare DBAs outputs. We find evidence for the positive role both in the perceived effort before and after the actual use of healthcare DBAs as well as in user goal magnitude and means-goal configuration on perceptions of usefulness and probability of considering outputs. © 2023 Elsevier B.V."
"Jiang H., Gomes P., Meer D.V.","Promoting continuity of care in nurse-patient assignment: A multiple objective heuristic algorithm",2023,"Decision Support Systems",,"10.1016/j.dss.2023.113926","https://www.scopus.com/inward/record.uri?eid=2-s2.0-85146954459&doi=10.1016%2fj.dss.2023.113926&partnerID=40&md5=1e0053e4e6acbeb6990cadab66665cae","Continuity of care is a critical element for delivering quality of care in inpatient units, however it has rarely been considered in nurse-patient assignment (NPA) models. The nursing literature suggests that continuity of care helps reduce medical errors and readmissions and increases patient satisfaction. Balancing patient assignments to nursing staff is also critical to avoid overwork and burnout. This study investigates the relationship between continuity of care and workload balance in NPA decisions in hospital inpatient units. We develop an NPA heuristic to guide continuity-care assignment while addressing the trade-off with workload balance. The heuristic prioritizes higher-acuity patients to the objective of continuity of care, while assignment of lower acuity patients seeks to minimize workload imbalance. A discrete event simulation model of an inpatient hospital unit is used to evaluate how the heuristic addresses the tradeoff between the two objectives under distinct work design scenarios. The heuristic enables significant increases in continuity of care for specific patient segments while limiting the impact on workload balance. We discuss implications for theory and managerial practice. © 2023 Elsevier B.V."
"Paparova D., Aanestad M., Vassilakopoulou P., Bahus M.K.","Data governance spaces: The case of a national digital service for personal health data",2023,"Information and Organization",,"10.1016/j.infoandorg.2023.100451","https://www.scopus.com/inward/record.uri?eid=2-s2.0-85150915482&doi=10.1016%2fj.infoandorg.2023.100451&partnerID=40&md5=376c38a439eceb88f12bf15f1880852f","This paper investigates data governance empirically by conducting a retrospective study of the ten-year evolution of a national digital service for personal health data in Norway. We show how data governance unfolds over time as data become shared and itinerant across multiple actors. Building on our findings, we introduce the concept of data governance spaces to refer to the authorized relationships among multiple actors, which specify the boundaries of decision-making authority, rights, roles, and responsibilities around data processing. We contribute to the literature on data governance by distinguishing between a) authority multiplication, where data are handed over to other actors to serve diverse purposes triggering horizontal dynamics, and b) actor subordination, where authorities delegate data handling for uniform purposes triggering vertical dynamics. Overall, the paper extends prior research by showing how data governance unfolds beyond intra-, or inter-organizational boundaries and shifts attention to data's pivotal role, and the purposes for which data are collected, shared or used across multiple actors. © 2023 The Authors"
"Anderson C., Baskerville R., Kaul M.","Managing compliance with privacy regulations through translation guardrails: A health information exchange case study",2023,"Information and Organization",,"10.1016/j.infoandorg.2023.100455","https://www.scopus.com/inward/record.uri?eid=2-s2.0-85147976737&doi=10.1016%2fj.infoandorg.2023.100455&partnerID=40&md5=e6189978b54766cf17f33b7b47321984","Information privacy is increasingly important in our digitally connected world, particularly in healthcare, and privacy regulations are ramping up to promote appropriate privacy practices. As a digital platform that enables healthcare providers to exchange protected health information (PHI), a health information exchange (HIE) is governed by health information privacy regulations. The challenge for HIEs is to operate in a way that will maximize information exchange while maintaining compliance with regulations that may constrain the sharing of PHI. Regulations impose a measure of universality through compliance requirements, while being flexible to allow adaptation to the local context. However, our longitudinal case study into the privacy policies of an HIE, demonstrates that the journey of privacy ideas from their original formulation in regulations, to their ultimate enactment in an organizational setting, is accompanied by translations, such that the final implementation may vary extensively from its original form. Such variability often results in interpretations that differ from what the regulators intended. Consequently, translation guardrails are necessary to protect against problematic translations of regulatory ideas which could lead to compliance issues and loss of platform participation. Our findings offer two contributions. First, we contribute to the compliance literature by explaining how guardrails can balance the use of permission and obligation schemas which are necessary to translate regulations into effective organizational policies for the success of HIEs and other information exchange platforms. Second, we contribute to extending translation theory by explaining how pragmatic reasoning schemas function as the mechanism through which translation of regulations occurs. © 2023 Elsevier Ltd"
"Hillebrand K., Hornuf L., Müller B., Vrankar D.","The social dilemma of big data: Donating personal data to promote social welfare",2023,"Information and Organization",1,"10.1016/j.infoandorg.2023.100452","https://www.scopus.com/inward/record.uri?eid=2-s2.0-85147553782&doi=10.1016%2fj.infoandorg.2023.100452&partnerID=40&md5=fcac2ff37b7d7f2b12ac8707c358b9da","When using digital devices and services, individuals provide their personal data to organizations in exchange for gains in various domains of life. Organizations use these data to run technologies such as smart assistants, augmented reality, and robotics. Most often, these organizations seek to make a profit. Individuals can, however, also provide personal data to public databases that enable nonprofit organizations to promote social welfare if sufficient data are contributed. Regulators have therefore called for efficient ways to help the public collectively benefit from its own data. By implementing an online experiment among 1696 US citizens, we find that individuals would donate their data even when at risk of getting leaked. The willingness to provide personal data depends on the perceived risk level of a data leak but not on a realistic impact of the data on social welfare. Individuals are less willing to donate their data to the private industry than to academia or the government. Finally, individuals are not sensitive to whether the data are processed by a human-supervised or a self-learning smart assistant. © 2023 The Authors"
"Ghosh S., Chakraborty S., Gupta N., Basu S.","What ails physician review websites? A study of information needs of patients",2023,"Decision Support Systems",,"10.1016/j.dss.2022.113897","https://www.scopus.com/inward/record.uri?eid=2-s2.0-85142390207&doi=10.1016%2fj.dss.2022.113897&partnerID=40&md5=49441dbe5db360018baccede723a96d5","Physician Review Websites (PRWs) help users select physicians by providing both structured and unstructured data on physicians and patients' experiences with physicians. In this paper, the adequacy of the available information on PRWs is investigated. An empirical study is conducted to understand the information that patients seek from PRWs through a survey instrument administered to 344 patients. A topic modelling approach is then employed on 666,551 text reviews of patients using data from a popular PRW in India to discover information available on the PRWs. Combining both approaches, it is found that 12 out of 25 topics are either unavailable or only partially available, indicating an information gap. Two topics which constitute the information gap are then utilised to conduct a full factorial experiment on 153 respondents using a Latin Square design. Experimental results demonstrate that adding relevant information improves the physician selection process. Our work contributes to the healthcare IS literature on online physician selection and the role of information availability. The results will help PRWs and hospitals decide how to restructure information on their websites and devise strategies to nudge patients to write reviews highlighting the desired information. © 2022 Elsevier B.V."
"Zhao Y., Zhang T., Dasgupta R.K., Xia R.","Narrowing the age-based digital divide: Developing digital capability through social activities",2023,"Information Systems Journal",5,"10.1111/isj.12400","https://www.scopus.com/inward/record.uri?eid=2-s2.0-85134208012&doi=10.1111%2fisj.12400&partnerID=40&md5=ce91d25e4e57e2f1a75eabedf0a73775","Healthcare information technologies (HIT) have shown great potential for improving the effectiveness and quality of healthcare services. However, the inequal ability of older adults to use HIT may limit their exploitation of these benefits. To narrow the age-based “digital divide”, this research further develops the concept of digital capability and emphasises the link between older adults and their social context. Based on a qualitative inductive study of 33 participants, who included Chinese patients and their family members, we generate a novel theoretical model for understanding the process by which social activities may shape older adults' digital capabilities. Based on the model, we suggest two strategies that might encourage older adults to engage with HIT. This research contributes to the information systems (IS) literature by strengthening digital capability as a conceptual lens to investigate individuals' engagement with information communication technologies (ICTs). It also extends research on the social context for ICT use by revealing how social processes at multiple levels influence digital capability development. Finally, this study offers practical implications for governments and private sectors to encourage and promote ICT use by older adults. © 2022 The Authors. Information Systems Journal published by John Wiley & Sons Ltd."
"Kellner D., Lowin M., Hinz O.","Improved healthcare disaster decision-making utilizing information extraction from complementary social media data during the COVID-19 pandemic",2023,"Decision Support Systems",,"10.1016/j.dss.2023.113983","https://www.scopus.com/inward/record.uri?eid=2-s2.0-85153794742&doi=10.1016%2fj.dss.2023.113983&partnerID=40&md5=3a129f5132e6e0b97105775b6bd253ab","Managing an extreme event like a healthcare disaster requires accurate information about the event's circumstances to comprehend the full consequences of acting. However, information quality is rarely optimal since it takes time to determine the information of relevance. The COVID-19 pandemic showed that even official data sources are far from optimal since they suffer from reporting delays that slow decision-making. To support decision-makers with timely information, we utilize data from online social networks to propose an adaptable information extraction solution to create indices helping to forecast COVID-19 case numbers and hospitalization rates. We show that combining heterogeneous data sources like Twitter and Reddit can leverage these sources' inherent complementarity and yield better predictions than those using a single data source alone. We further show that the predictions run ahead of the official COVID-19 incidences by up to 14 days. Additionally, we highlight the importance of model adjustments whenever new information becomes available or the underlying data changes by observing distinct changes in the presence of specific symptoms on Reddit. © 2023 Elsevier B.V."
"Ben-Assuli O., Heart T., Klempfner R., Padman R.","Human-machine collaboration for feature selection and integration to improve congestive Heart failure risk prediction",2023,"Decision Support Systems",,"10.1016/j.dss.2023.113982","https://www.scopus.com/inward/record.uri?eid=2-s2.0-85153623199&doi=10.1016%2fj.dss.2023.113982&partnerID=40&md5=5dbac7d5049201bef42f2ee2ae554ec0","The issue of harnessing machine learning (ML) algorithms for the prediction of adverse medical events is important considering the prevalence of vast repositories of patient-level medical data, and the quest to reduce healthcare costs while elevating the quality of care. Of particular interest is identifying a set of features that can better predict the risk of unplanned readmissions of chronically ill patients within 30 days post discharge, among them patients with Congestive Heart Failure (CHF). While numerous studies have employed ML algorithms to identify sets of significant features, only a handful have compared features extracted by various methods, and even fewer have compared the predictive power of feature sets selected by human experts to those selected by ML. Hence, this research aimed to elicit a comprehensive feature set selected by four ML algorithms and compare its predictive performance to that of a feature set selected by experts. We then evaluated a merged list of the two feature sets, constructing a human-machine collaborative set to predict the likelihood of 30-day unplanned readmission of CHF patients using data on 10,763 CHF patients hospitalized during the years 2010–2017. Our models achieved Area under the ROC Curve (AUC) above 0.8 and an Accuracy of ∼0.89, comparable to the best models in the extant literature. Moreover, the Human-Machine Collaborative model significantly outperformed (best AUC 0.836) other human-only selected models as well as the machine-selected set. This study contributes to a better understanding of the power of using ML for patient risk stratification with special attention to the benefits of human-machine collaboration, even when these two entities work separately or in parallel, for improved clinical decision making. © 2023 Elsevier B.V."
"Thiebes S., Gao F., Briggs R.O., Schmidt-Kraepelin M., Sunyaev A.","Design Concerns for Multiorganizational, Multistakeholder Collaboration: A Study in the Healthcare Industry",2023,"Journal of Management Information Systems",,"10.1080/07421222.2023.2172771","https://www.scopus.com/inward/record.uri?eid=2-s2.0-85152454635&doi=10.1080%2f07421222.2023.2172771&partnerID=40&md5=3f7d7e9c3c0508909c746e99d228f23f","Multiorganizational, multistakeholder (MO-MS) collaborations that may span organizational and national boundaries, present design challenges beyond those of smaller-scale collaborations. This study opens an exploratory research stream to discover and document design concerns for MO-MS collaboration systems beyond those of the single-task collaborations that have been the primary focus of collaboration engineering research. We chose the healthcare industry as the first target for this research because it has attributes common to many MO-MS domains, and because it faces significant challenges on a global scale, like the recent COVID-19 pandemic, for which MO-MS collaboration could offer solutions, as, for example, evidenced by the rapid collaborative development and distribution of COVID-19 vaccines. To this end, we reviewed 6,609 articles to find 100 articles that offered insights about the design of MO-MS collaboration systems, then conducted 50 semi-structured interviews in two countries with expert practitioners in the field. From those sources, we derived an eleven-category set of design concerns for MO-MS collaboration systems and argue their generalizability to other MO-MS domains. We offer exemplar probe questions that designers can use to increase the breadth and depth of requirements gathering for MO-MS collaboration systems. © 2023 Taylor & Francis Group, LLC."
"Connolly R., Sanchez O.P., Compeau D., Tacco F.","Understanding Engagement in Online Health Communities: A Trust-Based Perspective",2023,"Journal of the Association for Information Systems",,"10.17705/1jais.00785","https://www.scopus.com/inward/record.uri?eid=2-s2.0-85151952901&doi=10.17705%2f1jais.00785&partnerID=40&md5=c935c587f32334449ff1db01a49b9485","Online health communities (OHCs) represent a popular and valuable resource for those seeking health information, support, or advice. They have the potential to reduce dependency on traditional health information channels, increase health literacy and empower a broader range of individuals in relation to their health management decisions. Successful communities are characterized by high levels of trust in user-generated contributions, which is reflected in increased engagement and expressed through knowledge adoption and knowledge contribution. However, research shows that the majority of OHCs are composed of passive participants who do not contribute via posts, thereby threatening the sustainability of many communities and their potential for empowerment. Despite this fact, the relationship between trust and engagement, specifically the trust antecedents that influence engagement in the OHC community context has not been adequately explained in past research. In this study, we leverage social capital behavior and social exchange theory frameworks in order to provide a more granular trust-based elucidation of the factors that influence individuals’ engagement in OHCs. We collected data from 410 Brazilian participants of Facebook OHCs and tested the research model using partial least squares. The results confirm two new constructs—online community responsiveness and community support—as trust antecedents that influence engagement in OHCs, resulting in knowledge adoption and knowledge contribution responses. These findings contribute to the trust and engagement literatures and to social media research knowledge. From a practitioner perspective, the study findings can serve as an important guide for moderators and managers seeking to develop trusted and impactful OHCs. © 2023 by the Association for Information Systems."
"Fu S., Cai Z., Lim E., Liu Y., Tan C.-W., Lin Y., Deng S.","Unraveling the Effects of Mobile Application Usage on Users’ Health Status: Insights from Conservation of Resources Theory",2023,"Journal of the Association for Information Systems",,"10.17705/1jais.00808","https://www.scopus.com/inward/record.uri?eid=2-s2.0-85151946730&doi=10.17705%2f1jais.00808&partnerID=40&md5=c7299cdf24aee1b0035cf71e4b2312b5","Numerous studies have documented adverse consequences arising from increased technology usage and advocated for a reduction in such usage as a plausible remedy. However, such recommendations are often infeasible and oversimplistic given mounting evidence attesting to users’ growing reliance on technology in both their personal and professional lives. Building on conservation of resources (COR) theory, we construct a research model to explain how mobile application usage, as delineated by its breadth and depth, affects users’ nomophobia and sleep deprivation, which can have negative impacts on users’ health status. We also consider the moderating influence of physical activity in mitigating the effects of mobile application usage on users’ health. We validated our hypotheses via data collected by surveying 5,842 respondents. Empirical findings reveal that (1) nomophobia is positively influenced by mobile application usage breadth but negatively influenced by mobile application usage depth, (2) sleep deprivation is negatively influenced by mobile application usage breadth but positively influenced by mobile application usage depth, and (3) sleep deprivation and nomophobia negatively impact users’ health status, whereas (4) physical activity attenuates the impact of mobile application usage on sleep deprivation but not nomophobia. The findings from this study not only enrich the extant literature on the health outcomes of mobile application usage by unveiling the impact of mobile application usage patterns and physical activity on users’ health but they also inform practitioners on how calibrating usage breadth and depth, along with encouraging physical activity, can promote healthy habits among users. © 2023 by the Association for Information Systems."
