Authors,Title,Year,Source title,Cited by,DOI,Link,Abstract
"Liu Q.B., Liu X., Guo X.","The effects of participating in a physician-driven online health community in managing chronic disease: Evidence from two natural experiments",2020,"MIS Quarterly: Management Information Systems",44,"10.25300/MISQ/2020/15102","https://www.scopus.com/inward/record.uri?eid=2-s2.0-85087168083&doi=10.25300%2fMISQ%2f2020%2f15102&partnerID=40&md5=d128331cfef78e298b6e441c97cab81c","This research examines physician-driven online health communities (OHC), a social media application in healthcare that engages both patients and physicians. Drawing on the “patient-physician partnership” paradigm in managing chronic disease (Bodenheimer et al. 2002), we argue that physician-driven OHC facilitates patient-physician collaborative care and self-management support, which may improve patient wellbeing and patient-physician relationships. We test the mutual impact between patients' and physicians' participation in physician-driven OHC and the impact of patients' and physicians' participation on patient well-being and the patient-physician relationship in the context of managing diabetes and depression. We collect data from a leading Chinese online consultation platform. To make credible causal inference, we exploit two events that separately create plausibly exogenous variations in patients' and physicians' participation. We find that physicians' participation significantly increases patients' participation for both diabetes and depression, but patients' participation only increases physicians' participation for depression. Although both patients' and physicians' participation significantly improve patient well-being and the patient-physician relationship, there are interesting nuances in these effects over time. These findings have important implications for self-managing chronic diseases and healthcare policy making. © 2020 University of Minnesota. All rights reserved."
"Hansen S., James Baroody A.","Electronic health records and the logics of care: Complementarity and conflict in the U.S. Healthcare system",2020,"Information Systems Research",24,"10.1287/ISRE.2019.0875","https://www.scopus.com/inward/record.uri?eid=2-s2.0-85086398448&doi=10.1287%2fISRE.2019.0875&partnerID=40&md5=1ce660a494b6e6946b426a2b6a491475","The U.S. healthcare system has experienced rapid growth in the adoption and use of clinical health information technology, such as electronic health record (EHR) systems. In a field as complex and pluralistic as healthcare, the introduction of these sweeping information technology platforms is transforming the practices, roles, interdependencies, and communication mechanisms that connect a heterogeneous mix of stakeholders. In this study, we assess the impact of EHR adoption and use on the practices of U.S. healthcare stakeholders and the institutional logics that they instantiate. We identify four prominent logics around the adoption and use of EHR systems'medical professionalism, private sector managerialism, technical design, and regulatory oversight. Our analysis reveals the ways in which practices enacted through EHR systems interact to engender a confluence of the institutional logics that mark the field. Specifically, we theorize a mechanism by which the reticulation, or intertwining, of practices mediated by an EHR system variously fosters complementarity and conflict between institutional logics based on the commensurability of the organizing principles invoked. This proposed framework offers a novel approach to the role of information system use in the institutional dynamics of the healthcare system. In addition, this research offers a range of practical insights regarding the ways in which the diverse institutional logics of the U.S. healthcare system may be impacted by the growth of EHR system use. Copyright: © 2019 INFORMS"
"Chen L., Baird A., Straub D.","A linguistic signaling model of social support exchange in online health communities",2020,"Decision Support Systems",46,"10.1016/j.dss.2019.113233","https://www.scopus.com/inward/record.uri?eid=2-s2.0-85076837295&doi=10.1016%2fj.dss.2019.113233&partnerID=40&md5=0069eff7094cd0b64e6727a6fa5fd52a","Health care consumers and patients are increasingly using online health communities (OHCs) to exchange social support and enhance their well-being. The success of OHCs in promoting health, however, depends not just on posting activity by participants, but, crucially, on whether or not responses are subsequently received. While previous studies have considered various mechanisms by which the likelihood of social support provisioning can be increased (e.g., the establishment of social capital), the impacts of linguistic signals have yet to be considered. Therefore, we consider whether or not linguistic signals in posts—including sentiment valence, linguistic style matching, readability, post length, and spelling—impact the amount of support received. Adopting an overarching theoretical framework of signaling theory, this study proposes a model that explains the signaling roles of linguistic features within OHC posts in promoting social support provision from OHC participants. The research model is empirically tested on a large dataset collected from an OHC platform covering multiple health conditions. Results show that affective linguistic signals, including negative sentiment and linguistic style matching, are effective in invoking both informational and emotional support from the community. We also find that informative linguistic signals including readability, post length, and spelling are positively associated with informational support receipt, while readability and spelling are also positively associated with emotional support receipt. Overall, this research not only enriches our current understandings of the linguistic signaling in OHCs, but also provides practical insights into improving social support exchange in OHCs. © 2019 Elsevier B.V."
"Kandakoglu A., Sauré A., Michalowski W., Aquino M., Graham J., McCormick B.","A decision support system for home dialysis visit scheduling and nurse routing",2020,"Decision Support Systems",26,"10.1016/j.dss.2019.113224","https://www.scopus.com/inward/record.uri?eid=2-s2.0-85076562098&doi=10.1016%2fj.dss.2019.113224&partnerID=40&md5=551ad6e5251ef3a0d0823d8a6832cc3c","Over the last years home dialysis has become the preferred treatment option for some patients with kidney failure. However, determining efficient and effective daily home-dialysis service plans imposes multiple challenges to hospital administrators, as it is a complex task with a number of interrelated decisions. These decisions are about the number of nurses required for daily visits and their travel itineraries, and involve multiple (often conflicting) objectives. Working together with physicians and administrators from The Ottawa Hospital (TOH) in Canada, we have developed a system intended to support administrators of nephrology departments in creating daily visit schedules and routes for nurses assisting with dialysis treatment in patients' homes. The decision support system, called Home Dialysis Scheduler System (HDSS), employs a mixed-integer linear programming model to create daily nurse itineraries that minimize the cost of providing home dialysis for a pre-specified group of patients. In developing this model, we also considered nurses' workload balance, overtime work, need for mealtime breaks (lunch or dinner, depending on shift times), restrictions and preferences associated with the time of the visits, and different types of services provided to patients. The model was validated using data provided by the Division of Nephrology at TOH. The interface of the HDSS was developed following the principles of user-centred design and validated with a group of end-users. In the validation stage, daily visit schedules and nurse routes generated by the HDSS were compared to nurse itineraries created manually by hospital administrators. The use of the HDSS resulted in improved workload distribution among nurses, simpler routes, and reduced total distance travelled — which translates into lower costs for the home dialysis program. In this paper, we provide details about the mixed-integer linear programming model, describe the HDSS, and discuss its implementation results and managerial implications. © 2019 Elsevier B.V."
"Burton-Jones A., Akhlaghpour S., Ayre S., Barde P., Staib A., Sullivan C.","Changing the conversation on evaluating digital transformation in healthcare: Insights from an institutional analysis",2020,"Information and Organization",52,"10.1016/j.infoandorg.2019.100255","https://www.scopus.com/inward/record.uri?eid=2-s2.0-85073553423&doi=10.1016%2fj.infoandorg.2019.100255&partnerID=40&md5=9ff74f0dc951e40a3dc3226abecdd46f","The global health sector is engaged in significant digital transformation. Evaluating these transformations is important given the major investments involved and their major potential consequences. However, studies have critiqued both the quality of evaluations and the quality of evaluation research. The persistent lack of progress has led researchers to ask deeper questions about what is actually occurring when teams evaluate the benefits of digital transformation. This translational research essay explores how institutional theory offers a lens for understanding the complexities of evaluating digital transformations in healthcare and provides insights for improving it. In particular, we show how institutional theory can explain behaviors observed in the literature and in our own case study. We also show how institutional theory can benefit from the insights observed in evaluation work. Motivated by these opportunities, we suggest an agenda through which practitioners and researchers can jointly improve work in this area. © 2019 The Authors"
"Wang T., Qiu R.G., Yu M., Zhang R.","Directed disease networks to facilitate multiple-disease risk assessment modeling",2020,"Decision Support Systems",17,"10.1016/j.dss.2019.113171","https://www.scopus.com/inward/record.uri?eid=2-s2.0-85074422233&doi=10.1016%2fj.dss.2019.113171&partnerID=40&md5=2478379a0c1e3c115b4adbf2ba5897cc","We investigate multiple disease risk prediction modeling, aimed at assessing future disease risks for an individual who is ready for discharge after hospitalization. We propose a novel framework that combines directed disease network and recommendation system techniques to substantially enhance multiple disease risk predictive modeling. Firstly, a directed disease network considering temporal information is developed. Then based on this directed disease network, we look into different disease risk score computing approaches. We validate the proposed approaches with two real-world datasets from two independent hospitals. The predicted results can be promisingly utilized as a reference for medical experts to offer effective healthcare guidance for both inpatients and outpatients. The proposed framework can also be utilized for developing an innovative tool that helps individuals create and maintain a better healthcare plan over time. © 2019 Elsevier B.V."
"Steinhauser S., Doblinger C., Hüsig S.","The Relative Role of Digital Complementary Assets and Regulation in Discontinuous Telemedicine Innovation in European Hospitals",2020,"Journal of Management Information Systems",12,"10.1080/07421222.2020.1831778","https://www.scopus.com/inward/record.uri?eid=2-s2.0-85096931327&doi=10.1080%2f07421222.2020.1831778&partnerID=40&md5=60fb446d6a7de5d3c2a140e4ffaa9637","Telemedicine innovation is important for accelerating the digital transformation of the health care sector. However, telemedicine is a discontinuous digital innovation, and incumbent health care organizations are lagging in its adoption. We combine research on IT innovation adoption and discontinuous innovation to study the relative role of two drivers of discontinuous innovation adoption: digital complementary assets and the regulatory environment. Our findings from 1,753 acute care hospitals across 30 European countries suggest that digital complementary assets have a stronger effect on telemedicine innovation adoption than the regulatory framework. In addition, we observe application- and business model-specific differences. Overall, our findings add the role of organizational versus regulatory drivers of discontinuous innovation adoption to information systems research, emphasize the importance of digital complementary assets for the adoption of discontinuous innovation by incumbent organizations, and provide new insights into how the diffusion of telemedicine innovation can be accelerated. © 2020 Taylor & Francis Group, LLC."
"Mousavi R., Raghu T.S., Frey K.","Harnessing Artificial Intelligence to Improve the Quality of Answers in Online Question-answering Health Forums",2020,"Journal of Management Information Systems",15,"10.1080/07421222.2020.1831775","https://www.scopus.com/inward/record.uri?eid=2-s2.0-85096905113&doi=10.1080%2f07421222.2020.1831775&partnerID=40&md5=475b89d66c7e408827922c60e8da7cef","Quality of answers in health-related community-based question answering (HCQA) forums has been a concern for both users and forum administrators. We conducted a two-phase study to better understand the quality of answers in HCQA forums. First, we employed machine learning to examine the quality of health content. We validated our algorithmic quality ratings by comparing them with those of two physicians. Second, using data from Yahoo! Answers Health section, we examined the effect of the quality of the first answer on the quality of the subsequent answers. Our results suggest that the quality of the subsequent answers is impacted by the quality of the first displayed answer. We further show that the impact of the first displayed answer is larger when the answerers are more familiar with the forum but smaller when the forum provides tips for answering questions. Our study helps HCQA forums to improve the overall quality of answers by 1- creating an algorithmic solution that reliably measures the quality of answers, and 2- adjusting the order of existing answers to encourage higher quality subsequent answers. Our findings also extend the applicability of the order effect to online forums and provide evidence that experienced users would be more influenced by the order effect in such forums. © 2020 Taylor & Francis Group, LLC."
"Qi K., Han S.","Does it improve revenue management in hospitals?",2020,"Journal of the Association for Information Systems",1,"10.17705/1jais.00644","https://www.scopus.com/inward/record.uri?eid=2-s2.0-85096032732&doi=10.17705%2f1jais.00644&partnerID=40&md5=fb2064e7f8970dc8cc3763257a8c1e16","In this study, we examine the question of how the adoption of IT systems influences revenue management in hospitals. We posit that IT plays a vital role in enhancing revenue by increasing net patient revenue and decreasing the uncompensated care ratio. Using unique datasets from various proprietary resources, we test the relationships between IT (clinical and business) investment and revenue management performance using dynamic panel data models with the generalized method of moments (GMM). Empirical results generally support our hypotheses. We found that both clinical and business IT investment have short-term and long-term effects on boosting net patient revenue and that clinical IT investment has a short-term contemporaneous effect on reducing the uncompensated care ratio. Moderation analyses suggest that: (1) larger hospitals tend to utilize business IT systems better in facilitating revenue management through both channels over the long run, but not necessarily using clinical IT; and (2) for-profit hospitals outperform their nonprofit counterparts when it comes to managing revenues through clinical IT; however, no interaction effect with business IT was found. This paper contributes to the literatures on the business value of IT investment and healthcare IT in the fields of information systems, revenue management, healthcare administration. We conclude this paper by discussing theoretical and managerial implications. © 2020 by the Association for Information Systems."
"Califf C.B., Sarker S., Sarker S.","The bright and dark sides of technostress: A mixed-methods study involving healthcare it1",2020,"MIS Quarterly: Management Information Systems",92,"10.25300/MISQ/2020/14818","https://www.scopus.com/inward/record.uri?eid=2-s2.0-85094942480&doi=10.25300%2fMISQ%2f2020%2f14818&partnerID=40&md5=43d14ebe11851a26fd8f4df1ccdf86a0","Today's healthcare workers, specifically nurses, are experiencing technostress associated with the use of healthcare information technology (HIT). Technostress is often characterized by IS researchers as negative, or as being on the ""dark side"" of technology. However, a broader reading of the stress literature suggests that technostress may be both positive and negative, and can therefore have a ""bright side"" in addition to a dark side. The objective of this study is to conceptualize a holistic technostress process that includes positive and negative components of technostress embedded in two subprocesses: The techno-eustress subprocess and the techno-distress subprocess, respectively. The study instantiates this holistic technostress model through a sequential mixed-methods research design in the context of HIT. Phase 1 of the design is a qualitative, interpretive case study involving interviews with 32 nurses. Based on the findings from the case study, the paper builds a research model that operationalizes the concepts embedded in the holistic technostress model and identifies contextually relevant challenge and hindrance technostressors and outcomes. In Phase 2, the research model is empirically validated by analyzing survey data collected from 402 nurses employed in the United States. Results reveal that several challenge and hindrance technostressors are related to positive and negative psychological responses, respectively, and that such responses are related to job satisfaction and attrition, which impact turnover intention. Contributions to theory and practice are also discussed. © 2020 University of Minnesota. All rights reserved."
"Sun S., Lu S.F., Rui H.","Does telemedicine reduce emergency room congestion? evidence from new york state",2020,"Information Systems Research",24,"10.1287/ISRE.2020.0926","https://www.scopus.com/inward/record.uri?eid=2-s2.0-85092890509&doi=10.1287%2fISRE.2020.0926&partnerID=40&md5=87550e18033b94c286bdb6c8ff53ec23","Overcrowding in emergency rooms (ERs) is a common yet nagging problem. It not only is costly for hospitals but also compromises care quality and patient experience. Hence, finding effective ways to improve ER care delivery is of great importance. Using a large data set covering all emergency visits in New York State from 2010 to 2014, we investigate whether telemedicine enhances ER care delivery. We show that, on average, telemedicine availability in the ER significantly reduces average patients' length of stay (LOS), which is partially driven by the flexible resource allocation. Specifically, the adoption of telemedicine leads to a larger reduction in ER LOS when there is a demand surge or supply shortage. Furthermore, such improvement is not a by-product of other widely adopted health IT applications and does not come at the expense of care quality or patient cost. We also replicate the analysis using annual U.S. hospital data and find that ER telemedicine adoption significantly reduces average patients' waiting time, which suggests that the LOS reduction partially comes from the reduction of waiting time. © 2020 INFORMS."
"Li X., Rai A., Ganapathy K.","Designing cost-effective telemedicine camps for underprivileged individuals in less developed countries: A decomposed affordance-effectivity framework",2020,"Journal of the Association for Information Systems",11,"10.17705/1jais.00637","https://www.scopus.com/inward/record.uri?eid=2-s2.0-85091344638&doi=10.17705%2f1jais.00637&partnerID=40&md5=6de47c0538c2c828aa15ce4cf67e39c1","Free telemedicine camps (telecamps) are emergent joint initiatives of healthcare organizations, national and local governments, and not-for-profit nongovernmental organizations (NGOs) with the goal of alleviating the health divide for underprivileged individuals in rural areas of less developed countries. Our study seeks to understand the effectiveness of physician-patient communication at telecamps with several salient characteristics: rural underprivileged patients, physicians in remote cities, and frugal telemedicine technology—specifically, videoconferencing—deployed in Hospitals on Wheels and appropriated by operators. We adopt a multiple-actor perspective, propose a decomposed affordance-effectivity framework, and combine variance and process perspectives to examine the phenomenon of interest. We collaborated with Apollo Hospitals, a leading hospital system in India, and collected multisource data from two major telecamps in rural South India. Based on an analysis of survey data from 216 telecamp participants through a variance perspective, we found support for the fit of patient-perceived media richness with two contingency factors—(1) disease diagnostic complexity and (2) patient healthcare needs fulfillment—in influencing patient satisfaction with teleconsultation. Based on an analysis of 46 sessions of teleconsultation video archives through a process perspective, we found that technology appropriation is realized through verbal and nonverbal communication events between patients and physicians, with on-site operators playing multiple roles that serve as “compensatory user effectivity.” Our findings yield theoretical and practical implications for how effective telemedicine encounters using frugal technologies can be designed in combination with other cost-effective support personnel resources to broaden healthcare access for underprivileged individuals in less developed countries and, more broadly, to actualize technology affordances in use situations involving multiple actors. © 2020, Association for Information Systems. All rights reserved."
"Riemer K., Ciriello R., Peter S., Schlagwein D.","Digital contact-tracing adoption in the COVID-19 pandemic: IT governance for collective action at the societal level",2020,"European Journal of Information Systems",53,"10.1080/0960085X.2020.1819898","https://www.scopus.com/inward/record.uri?eid=2-s2.0-85091290566&doi=10.1080%2f0960085X.2020.1819898&partnerID=40&md5=2a29f54c338d12278ff41b5c2a17a699","The COVID-19 pandemic has created a need for rapid, population-wide digital contact tracing. One solution, Bluetooth-enabled digital proximity tracing using smartphones, promises to preserve individual privacy while helping to contain society-wide viral outbreaks. However, this digital solution works effectively only if adopted by the majority of the population. This poses a collective action problem: everyone would benefit from wide-spread proximity tracing, but the benefits for the individual are indirect and limited. To facilitate such collective action at the societal level, this paper conceptualises the option space of IT governance actions for proximity tracing adoption along two dimensions: decision-making entities (who will govern the roll-out) and accountability enforcement (how strictly will adoption and use be enforced). Examining coherent governance approaches that arise from the framework, we show that there are no globally ideal approaches but only locally contextualised ones that depend on immediate health risk, prior experience with pandemics, societal values and national culture, role of government, trust in government and trust in technology in each society. The paper contributes specific propositions for governing digital contact tracing in the COVID-19 pandemic and general theoretical implications for IT governance for collective action at the societal level. © Operational Research Society 2020."
"Ketter W., Padmanabhan B., Pant G., Raghu T.S.","Addressing societal challenges through analytics: An ESG ice framework and research agenda",2020,"Journal of the Association for Information Systems",6,"10.17705/1jais.00631","https://www.scopus.com/inward/record.uri?eid=2-s2.0-85090920673&doi=10.17705%2f1jais.00631&partnerID=40&md5=63b9b56df7715967c8a2a91d3e67242d","There is both a need and an opportunity to develop analytics-driven approaches to address many significant challenges facing society. Toward this end, this article presents an “ESG-ICE” framework that builds on environmental, social, and governance (ESG) perspectives by considering their interactions with desirable outcomes such as individual well-being, community welfare, and economic resilience (ICE). We then provide exemplars of research problems in energy, mobility, and health that can be positioned and understood through this lens so that they can be solved through analytics. Recognizing that addressing societal challenges through analytics presents unique methodological challenges, we highlight specific opportunities that emerge for the design of (1) new cyberphysical infrastructures, (2) smart markets and decision support systems, (3) hybrid predictive, prescriptive, and causal approaches, and (4) mechanisms that facilitate data sharing. © 2020 by the Association for Information Systems."
