Authors,Title,Year,Source title,Cited by,DOI,Link,Abstract
"Rodríguez A., Fernández-Medina E., Trujillo J., Piattini M.","Secure business process model specification through a UML 2.0 activity diagram profile",2011,"Decision Support Systems",52,"10.1016/j.dss.2011.01.018","https://www.scopus.com/inward/record.uri?eid=2-s2.0-79955884819&doi=10.1016%2fj.dss.2011.01.018&partnerID=40&md5=fd5fb3a76b4af37fcaf4523cfb7a4efd","Business processes have become important resources, both for an enterprise's performance and to enable it to maintain its competitiveness. The languages used for business process representation have, in recent years, been improved and new notations have appeared. However, despite the wide acceptance of the importance of business process security, to date the business analyst perspective in relation to security has hardly been dealt with. Moreover, security requirements cannot be represented in modern business process modeling notations. In this paper, we present an extension of UML 2.0 activity diagrams which will allow security requirements to be specified in business processes. Our proposal, denominated as BPSec (Business Process Security), is Model Driven Architecture compliant since it is possible to obtain a set of UML artifacts (Platform Independent Model-PIM) used in software development from a Secure Business Process model specification (Computation Independent Model-CIM). We also present the application of our approach to an example based on a typical health care institution, in which our M-BPSec method is employed as a framework for the use of our UML extension. © 2011 Elsevier B.V. All rights reserved."
"Meiller Y., Bureau S., Zhou W., Piramuthu S.","Adaptive knowledge-based system for health care applications with RFID-generated information",2011,"Decision Support Systems",32,"10.1016/j.dss.2010.12.008","https://www.scopus.com/inward/record.uri?eid=2-s2.0-79951512095&doi=10.1016%2fj.dss.2010.12.008&partnerID=40&md5=6f71e0accdbb862013e77bdd630c5c0e","Health care organizations are under increased pressure to continually improve their operational efficiency while simultaneously decreasing the overall operating costs with no appreciable degradation in the delivered quality of health care. Given the nature of such an environment where lives are at stake, it is natural to operate under a larger safety factor where risks are kept close to their necessary minimum. RFID tags are increasingly being used in health care organizations to reduce errors and to generally improve the effectiveness of the core processes. We develop an adaptive knowledge-based system framework for health care and illustrate the proposed framework using three example applications from the French health care environment. Specifically, we consider management of bottled gas delivery as well as tracking and tracing surgical equipment and prosthetic ancillaries within a health care environment using the proposed framework with item-level information generated through RFID tags. We use simulation analyses to study the underlying dynamics. © 2010 Elsevier B.V. All rights reserved."
"Airoldi E.M., Bai X., Malin B.A.","An entropy approach to disclosure risk assessment: Lessons from real applications and simulated domains",2011,"Decision Support Systems",16,"10.1016/j.dss.2010.11.014","https://www.scopus.com/inward/record.uri?eid=2-s2.0-79951510971&doi=10.1016%2fj.dss.2010.11.014&partnerID=40&md5=f6a622935121ed2e4560c3bfbd9fc26d","We live in an increasingly mobile world, which leads to the duplication of information across domains. Though organizations attempt to obscure the identities of their constituents when sharing information for worthwhile purposes, such as basic research, the uncoordinated nature of such environment can lead to privacy vulnerabilities. For instance, disparate healthcare providers can collect information on the same patient. Federal policy requires that such providers share ""de-identified"" sensitive data, such as biomedical (e.g., clinical and genomic) records. But at the same time, such providers can share identified information, devoid of sensitive biomedical data, for administrative functions. On a provider-by-provider basis, the biomedical and identified records appear unrelated, however, links can be established when multiple providers' databases are studied jointly. The problem, known as trail disclosure, is a generalized phenomenon and occurs because an individual's location access pattern can be matched across the shared databases. Due to technical and legal constraints, it is often difficult to coordinate between providers and thus it is critical to assess the disclosure risk in distributed environments, so that we can develop techniques to mitigate such risks. Research on privacy protection has so far focused on developing technologies to suppress or encrypt identifiers associated with sensitive information. There is a growing body of work on the formal assessment of the disclosure risk of database entries in publicly shared databases, but less attention has been paid to the distributed setting. In this research, we review the trail disclosure problem in several domains with known vulnerabilities and show that disclosure risk is influenced by the distribution of how people visit service providers. Based on empirical evidence, we propose an entropy metric for assessing such risk in shared databases prior to their release. This metric assesses risk by leveraging the statistical characteristics of a visit distribution, as opposed to person-level data. It is computationally efficient and superior to existing risk assessment methods, which rely on ad hoc assessment that are often computationally expensive and unreliable. We evaluate our approach on a range of location access patterns in simulated environments. Our results demonstrate that the approach is effective at estimating trail disclosure risks and the amount of self-information contained in a distributed system is one of the main driving factors. © 2010 Elsevier B.V. All rights reserved."
"Mukhopadhyay T., Singh P., Kim S.H.","Learning curves of agents with diverse skills in information technology-enabled physician referral systems",2011,"Information Systems Research",22,"10.1287/isre.1110.0359","https://www.scopus.com/inward/record.uri?eid=2-s2.0-84865099412&doi=10.1287%2fisre.1110.0359&partnerID=40&md5=ed30704230c0cd30787efb33c828cd90","To improve operational efficiencies while providing state of the art healthcare services, hospitals rely on Tinformation technology enabled physician referral systems (IT-PRS). This study examines learning curves in an IT-PRS setting to determine whether agents achieve performance improvements from cumulative experience at different rates and how information technologies transform the learning dynamics in this setting. We present a hierarchical Bayes model that accounts for different agent skills (domain and system) and estimate learning rates for three types of referral requests: emergency (EM), nonemergency (NE), and nonemergency out of network (NO). Furthermore, the model accounts for learning spillovers among the three referral request types and the impact of system upgrade on learning rates. We estimate this model using data from more than 80,000 referral requests to a large IT-PRS. We find that: (1) The IT-PRS exhibits a learning rate of 4.5% for EM referrals, 7.2% for NE referrals, and 12.3% for NO referrals. This is slower than the learning rate of manufacturing (on average 20%) and more comparable to other service settings (on average, 8%). (2) Domain and system experts are found to exhibit significantly different learning behaviors. (3) Significant and varying learning spillovers among the three referral request types are also observed. (4) The performance of domain experts is affected more adversely in comparison to system experts immediately after system upgrade. (5) Finally, the learning rate change subsequent to system upgrade is also higher for system experts in comparison to domain experts. Overall, system upgrades are found to have a long-term positive impact on the performance of all agents. This study contributes to the development of theoretically grounded understanding of learning behaviors of domain and system experts in an IT-enabled critical healthcare service setting. © 2011 INFORMS."
"Ozdemir Z., Barron J., Bandyopadhyay S.","An analysis of the adoption of digital health records under switching costs",2011,"Information Systems Research",51,"10.1287/isre.1110.0349","https://www.scopus.com/inward/record.uri?eid=2-s2.0-84865098949&doi=10.1287%2fisre.1110.0349&partnerID=40&md5=467480092cd989fdb79cbf98c019d5f2","We investigate the incentive issues that surround the adoption and sharing of electronic health records (EHR) Wand the potential role of a personal health record (PHR) platform in facilitating data sharing. Through our analysis, we find evidence that health-care providers may not have an incentive to share patients' records electronically even though EHR systems will increase consumer surplus, especially in the presence of provider heterogeneity and myopic consumers. In this context, we find that an independent PHR platform can create incentives for the providers to share their patients' records electronically with other providers by selectively subsidizing them. In a pluralistic health-care system like that in the United States, where health-care providers have varying incentives to implement electronic health records, an online PHR platform can provide a proxy for a ""national health information network,""' wherein consumers can freely exchange their health records among competing providers. © 2011 INFORMS."
"Goh J.M., Gao G., Agarwal R.","Evolving work routines: Adaptive routinization of information technology in healthcare",2011,"Information Systems Research",202,"10.1287/isre.1110.0365","https://www.scopus.com/inward/record.uri?eid=2-s2.0-84865093602&doi=10.1287%2fisre.1110.0365&partnerID=40&md5=45ed4e3fba22ebacbdd923537e0e4994","Despite the significant potential for performance gains from health IT (HIT), there has been limited study of the mechanisms underlying successful HIT implementations. We conducted an extensive longitudinal field study to gain an understanding of the interplay between technology and patterns of clinical work embodied in routines. We use the analytical device of narrative networks to identify where and how HIT influences patterns of work. We further draw upon adaptive structuration theory to conceptualize HIT as an intervention that alters the flow of events in a narrative network. Our findings suggest that the key to successful implementation is to manage the co-evolution process between routines and HIT and to actively orchestrate a virtuous cycle through agentic action. We propose a dynamic process model of adaptive routinization of HIT that delineates the major channels through which HIT and routines interact, identifies the different stages in the dynamic co-evolution process, and isolates the pivotal role of two forms of agency in enabling the virtuous cycle of co-evolution. This is one of the first studies to offer a processual, microlevel analysis of HIT implementation in a clinical setting. © 2011 INFORMS."
"Venkatesh V., Zhang X., Sykes T.A.","""Doctors do too little technology"": A longitudinal field study of an electronic healthcare system implementation",2011,"Information Systems Research",187,"10.1287/isre.1110.0383","https://www.scopus.com/inward/record.uri?eid=2-s2.0-84865090669&doi=10.1287%2fisre.1110.0383&partnerID=40&md5=6586c34fe847d849d6f620010dd4d983","With the strong ongoing push toward investment in and deployment of electronic healthcare (e-healthcare) systems, understanding the factors that drive the use of such systems and the consequences of using such systems is of scientific and practical significance. Elaborate training in new e-healthcare systems is not a luxury that is typically available to healthcare professionals-i.e., doctors, paraprofessionals (e.g., nurses) and administrative personnel-because of the 24 × 7 nature and criticality of operations of healthcare organizations, especially hospitals, thus making peer interactions and support a key driver of or barrier to such e-healthcare system use. Against this backdrop, using social networks as a theoretical lens, this paper presents a nomological network related to e-healthcare system use. A longitudinal study of an e-healthcare system implementation, with data gathered from doctors, paraprofessionals, administrative personnel, patients, and usage logs lent support to the hypotheses that: (1) ingroup and outgroup ties to doctors negatively affect use in all user groups; (2) ingroup and outgroup ties to paraprofessionals and administrative personnel positively affect use in both those groups, but have no effect on doctors' use; and (3) use contributes positively to patient satisfaction mediated by healthcare quality variables-i.e., technical quality, communication, interpersonal interactions, and time spent. This work contributes to the theory and practice related to the success of e-healthcare system use in particular, and information systems in general. © 2011 INFORMS."
"Anderson C.L., Agarwal R.","The digitization of healthcare: Boundary risks, emotion, and consumer willingness to disclose personal health information",2011,"Information Systems Research",369,"10.1287/isre.1100.0335","https://www.scopus.com/inward/record.uri?eid=2-s2.0-84865072497&doi=10.1287%2fisre.1100.0335&partnerID=40&md5=2b7ed356ad9b9a9d69c2032d2def3584","As healthcare becomes increasingly digitized, the promise of improved care enabled by technological Aadvances inevitably must be traded off against any unintended negative consequences. There is little else that is as consequential to an individual as his or her health. In this context, the privacy of one's personal health information has escalated as a matter of significant concern for the public. We pose the question: under what circumstances will individuals be willing to disclose identified personal health information and permit it to be digitized? Using privacy boundary theory and recent developments in the literature related to risk-as-feelings as the core conceptual foundation, we propose and test a model explicating the role played by type of information requested (general health, mental health, genetic), the purpose for which it is to be used (patient care, research, marketing), and the requesting stakeholder (doctors/hospitals, the government, pharmaceutical companies) in an individual's willingness to disclose personal health information. Furthermore, we explore the impact of emotion linked to one's health condition on willingness to disclose. Results from a nationally representative sample of over 1,000 adults underscore the complexity of the health information disclosure decision and show that emotion plays a significant role, highlighting the need for re-examining the timing of consent. Theoretically, the study extends the dominant cognitive-consequentialist approach to privacy by incorporating the role of emotion. It further refines the privacy calculus to incorporate the moderating influence of contextual factors salient in the healthcare setting. The practical implications of this study include an improved understanding of consumer concerns and potential impacts regarding the electronic storage of health information that can be used to craft policy. © 2011 INFORMS."
"Chen Y.-D., Brown S.A., Hu P.J.-H., King C.-C., Chen H.","Managing emerging infectious diseases with information systems: Reconceptualizing outbreak management through the lens of loose coupling",2011,"Information Systems Research",19,"10.1287/isre.1110.0376","https://www.scopus.com/inward/record.uri?eid=2-s2.0-84865070510&doi=10.1287%2fisre.1110.0376&partnerID=40&md5=978958d7c5b40c8ebfd009ecec83ba4a","Increasing global connectivity makes emerging infectious diseases (EID) more threatening than ever before. Various information systems (IS) projects have been undertaken to enhance public health capacity for detect- ing EID in a timely manner and disseminating important public health information to concerned parties. While those initiatives seemed to offer promising solutions, public health researchers and practitioners raised concerns about their overall effectiveness. In this paper, we argue that the concerns about current public health IS projects are partially rooted in the lack of a comprehensive framework that captures the complexity of EID management to inform and evaluate the development of public health IS. We leverage loose coupling to analyze news cov- erage and contact tracing data from 479 patients associated with the severe acute respiratory syndrome (SARS) outbreak in Taiwan. From this analysis, we develop a framework for outbreak management. Our proposed framework identifies two types of causal circles-coupling and decoupling circles-between the central public health administration and the local capacity for detecting unusual patient cases. These two circles are triggered by important information-centric activities in public health practices and can have significant influence on the effectiveness of EID management. We derive seven design guidelines from the framework and our analysis of the SARS outbreak in Taiwan to inform the development of public health IS. We leverage the guidelines to evaluate current public health initiatives. By doing so, we identify limitations of existing public health IS, highlight the direction future development should consider, and discuss implications for research and public health policy. © 2011 INFORMS."
"Fichman R.G., Kohli R., Krishnan R.","The role of information systems in healthcare: Current research and future trends",2011,"Information Systems Research",328,"10.1287/isre.1110.0382","https://www.scopus.com/inward/record.uri?eid=2-s2.0-84858781434&doi=10.1287%2fisre.1110.0382&partnerID=40&md5=416e1791ba824587d16d3487aed84e46","Information systems have great potential to reduce healthcare costs and improve outcomes. The purpose of Ithis special issue is to offer a forum for theory-driven research that explores the role of IS in the delivery of healthcare in its diverse organizational and regulatory settings. We identify six theoretically distinctive elements of the healthcare context and discuss how these elements increase the motivation for, and the salience of, the research results reported in the nine papers comprising this special issue. We also provide recommendations for future IS research focusing on the implications of technology-driven advances in three areas: social media, evidence-based medicine, and personalized medicine. © 2011 INFORMS."
"Kane G.C., Borgatti S.P.","Centrality-is proficiency alignment and workgroup performance",2011,"MIS Quarterly: Management Information Systems",50,"10.2307/41409973","https://www.scopus.com/inward/record.uri?eid=2-s2.0-81355153648&doi=10.2307%2f41409973&partnerID=40&md5=c4c0edc1b768828454d798f7f4ba04b2","Virtually all of the extensive previous research investigating the effect of information systems proficiency on performance has been conducted at the individual level. Little research has investigated the relationship between IS proficiency and performance at the group level. In this paper, we argue that IS proficiency at the group level may be more than the simple sum or average of the IS proficiency of individual group members. Rather, effective group-level IS proficiency may also be a function of how a group's IS proficiency is distributed across its members. Relying on concepts associated with social network analysis (SNA), we introduce the concept of centrality-IS proficiency alignment. We argue that groups will perform better if their more proficient members are highly central in the group's communication and workflows network. Data from 468 employees in 32 workgroups show that centrality-IS proficiency alignment is significantly and positively related to performance across multiple systems examined individually and with the portfolio of systems examined as a whole. This approach effectively integrates the structural and resource perspectives of SNA, providing a roadmap so that others may follow a similar approach to address broader questions of group-level user-system interactions in the IS literature and more general questions of central resource alignment in the broader organizational literature."
"Kane G.C., Labianca G.","IS Avoidance in health-care groups: A multilevel investigation",2011,"Information Systems Research",102,"10.1287/isre.1100.0314","https://www.scopus.com/inward/record.uri?eid=2-s2.0-80955141404&doi=10.1287%2fisre.1100.0314&partnerID=40&md5=ef003d9f3ffbd1810d5bfd7601623dc3","The information systems (IS) literature has focused considerable research on IS resistance, particularly in the health-care industry. Most of this attention has focused on the impact of IS resistance on systems' initial implementation, but little research has investigated whether and how post-adoption resistance affects performance. We focus on a particular type of post-adoption resistance, which we call IS avoidance, to identify situations in which individuals avoid working with adopted IS despite the need and opportunity to do so. We examine the effects of IS avoidance on patient care delivered by health-care groups across three levels of analysis: the individual level, the shared group level, and the configural group level. We find that IS avoidance is significantly and negatively related to patient care only at the configural group level, which suggests that patient care is not degraded by the number of doctors and/or nurses in a group avoiding a system, but rather by their locations in the group's workflow network configuration. We use qualitative data collected over 16 months at the research site to help explain these results. Implications for theory and practice are discussed. © 2011 INFORMS."
"Newell S.","Special section on healthcare information systems",2011,"Journal of Strategic Information Systems",14,"10.1016/j.jsis.2011.05.002","https://www.scopus.com/inward/record.uri?eid=2-s2.0-79959941609&doi=10.1016%2fj.jsis.2011.05.002&partnerID=40&md5=739ef2e03a7b831ce004416878043068","Several countries are working on developing ways to use Information Technology (IT) in the healthcare industry in order to improve efficiencies, and at the same time not reducing healthcare and healthcare service delivery. The American Recovery and Reinvestment Act of 2009 provided $36 billion for health IT in the USA. IT plays a significant role in healthcare settings, with a view to helping to improve efficiency and/or safety and/or the patient experience. Different healthcare providers might have different strategies, so that the design of the IS will need to be customized to the particular business context. Boonstra, Broekhuism, Van Offenbeek and Wortman made analysis of the strategic alignment between two telecare initiatives and demonstrated that the strategic alignment model (SAM) model can be applied to different business models that can be associated with different healthcare service delivery strategies."
"Setia P., Setia M., Krishnan R., Sambamurthy V.","The effects of the assimilation and use of IT applications on financial performance in healthcare organizations",2011,"Journal of the Association for Information Systems",43,"10.17705/1jais.0060","https://www.scopus.com/inward/record.uri?eid=2-s2.0-79957832453&doi=10.17705%2f1jais.0060&partnerID=40&md5=3d76f9627a6cc09f644d468f13c5bc0e","This research examines the impacts of the assimilation and use of IT on the financial performance of hospitals. We identify two dimensions of IT assimilation and use. They are the IT applications architecture spread, which is the adoption of a broad array of IT solutions, and IT applications architecture longevity, which is the length of experience with use of specific IT solutions. We examine the extent to which these dimensions of assimilation within the business and clinical work processes impact hospital performance. Compared with the effects of IT applications architecture spread, we find that the IT applications architecture longevity has a more significant effect on financial performance. In addition, the effects of assimilation manifest differently across the business and clinical process domains. Our results enhance understanding about the manner in which the assimilation and use of IT contributes to the financial performance of hospitals."
